{
  "schema_version": 1,
  "pipeline_version": "v6",
  "run_id": "data-analysis-2026-01-19-20260119032115.-0f547dff",
  "date": "2026-01-19",
  "source": "huggingface",
  "generated_at": "2026-01-19T03:21:15.068Z",
  "items": [],
  "stats": {
    "total": 0,
    "matched_prompt_hash": 0,
    "mismatched_prompt_hash": 5
  }
}
