{
  "schema_version": 1,
  "pipeline_version": "v6",
  "run_id": "data-analysis-2025-10-23-20251023025551.-53c585f1",
  "date": "2025-10-23",
  "source": "huggingface",
  "generated_at": "2025-10-23T02:55:51.568Z",
  "items": [
    {
      "canonical_id": "huggingface:mistralai/Mistral-7B-Instruct-v0.2",
      "promptHash": "sha256:fa0e22611f5250fdbfee4e6458742890d2006df39f5e23084ae0500a1419cff8",
      "summary_version": 1,
      "status": "qualified",
      "name": "Mistral-7B-Instruct-v0.2",
      "url": "https://huggingface.co/mistralai/Mistral-7B-Instruct-v0.2",
      "tags": [
        "transformers",
        "pytorch",
        "safetensors",
        "mistral",
        "text-generation",
        "finetuned",
        "mistral-common",
        "conversational",
        "arxiv:2310.06825",
        "license:apache-2.0",
        "autotrain_compatible",
        "text-generation-inference",
        "region:us"
      ],
      "summaries": {
        "en": "Mistral-7B-Instruct-v0.2 is a fine-tuned 7-billion parameter language model optimized for following instructions and engaging in natural conversations, making AI assistance more accessible and responsive. It builds on Mistral's efficient architecture with sliding window attention, enabling longer context handling while maintaining computational efficiency. You can deploy it via Hugging Face pipelines for chatbots, content generation, or fine-tune it further on custom datasets to create specialized assistants for coding, writing, or research tasks.",
        "zh": "Mistral-7B-Instruct-v0.2 是一个经过指令微调的 70 亿参数语言模型，专门优化用于理解并执行用户指令、进行自然对话，让 AI 助手更贴近实际应用需求。其技术亮点在于采用了滑动窗口注意力机制，能在处理长文本时保持高效计算，平衡了性能与资源消耗。开发者可通过 Hugging Face 快速集成到聊天机器人、内容创作工具中，或基于自有数据进一步微调，打造面向编程、写作或研究等场景的专属智能助手，探索个性化 AI 应用的可能。",
        "es": "Mistral-7B-Instruct-v0.2 is a fine-tuned 7-billion parameter language model optimized for following instructions and engaging in natural conversations, making AI assistance more accessible and responsive. It builds on Mistral's efficient architecture with sliding window attention, enabling longer context handling while maintaining computational efficiency. You can deploy it via Hugging Face pipelines for chatbots, content generation, or fine-tune it further on custom datasets to create specialized assistants for coding, writing, or research tasks."
      },
      "summary_short": {
        "zh": "Mistral-7B-Instruct-v0.2 是一个经过指令微调的 70 亿参数语言模型，专门优化用于理解并执行用户指令、进行自然对话，让 AI 助手更贴近实际应用需求。其技术亮点在于采用了滑动窗口注意力机制，能在处理长文本时保持高效计算，平衡了性能与资源消耗。开发者可通过 Hugging Face 快速集成到聊天机器人、内容创作工具中，或基于自有数据进一步微调，打造面向编程、写作或研究等场景的专属智能助手，探索个性化 AI 应用的可能。",
        "en": "Mistral-7B-Instruct-v0.2 is a fine-tuned 7-billion parameter language model optimized for following instructions and engaging in natural conversations, making AI assistance more accessible and responsive. It builds on Mistral's efficient architecture with sliding window attentio…",
        "es": "Mistral-7B-Instruct-v0.2 is a fine-tuned 7-billion parameter language model optimized for following instructions and engaging in natural conversations, making AI assistance more accessible and responsive. It builds on Mistral's efficient architecture with sliding window attentio…"
      },
      "locales": [
        "en",
        "zh",
        "es"
      ],
      "provider": {
        "name": "deepseek-tri",
        "version": "1.0.0",
        "mode": "json_single"
      },
      "quality": {
        "score": 0.92,
        "fallback": false,
        "length": {
          "en": 553,
          "zh": 223,
          "es": 553
        },
        "warnings": [
          "es_short:0"
        ],
        "accepted_at": "2025-10-23T02:54:56.950Z"
      },
      "stats": {
        "downloads_total": 2001151,
        "likes_total": 2988
      },
      "metadata": {
        "license": "N/A",
        "lang": "N/A",
        "categories": {
          "capabilities": [],
          "scenes": [],
          "lifecycle": []
        }
      },
      "created_at": "2025-10-23T02:54:56.950Z",
      "updated_at": "2025-10-23T02:54:56.950Z",
      "first_generated_at": "2025-10-23T02:54:56.950Z",
      "source": "huggingface"
    }
  ],
  "stats": {
    "total": 1,
    "matched_prompt_hash": 1,
    "mismatched_prompt_hash": 0
  }
}
