{
  "schema_version": 1,
  "pipeline_version": "v6",
  "run_id": "data-analysis-2026-05-28-20260528040153.-a71fa1c4",
  "date": "2026-05-28",
  "source": "huggingface",
  "generated_at": "2026-05-28T04:01:53.683Z",
  "items": [
    {
      "canonical_id": "huggingface:BAAI/bge-small-en-v1.5",
      "promptHash": "sha256:5ed6cb6fb5aa934e43677a957100253b7a8572eaddddcf9750de5c99dd45f1f3",
      "summary_version": 1,
      "status": "qualified",
      "name": "bge-small-en-v1.5",
      "url": "https://huggingface.co/BAAI/bge-small-en-v1.5",
      "tags": [
        "sentence-transformers",
        "pytorch",
        "onnx",
        "safetensors",
        "bert",
        "feature-extraction",
        "sentence-similarity",
        "transformers",
        "mteb",
        "en",
        "arxiv:2401.03462",
        "arxiv:2312.15503",
        "arxiv:2311.13534",
        "arxiv:2310.07554",
        "arxiv:2309.07597",
        "license:mit",
        "model-index",
        "text-embeddings-inference",
        "endpoints_compatible",
        "deploy:azure",
        "region:us"
      ],
      "summaries": {
        "en": "BGE-small-en-v1.5 is a compact English sentence embedding model that converts text into meaningful numerical representations for semantic similarity tasks. It employs contrastive learning with hard negatives and knowledge distillation from larger models, achieving strong performance despite its small size. You can use it for semantic search, clustering similar documents, or as a lightweight encoder in retrieval-augmented generation pipelines, making it ideal for resource-constrained applications.",
        "zh": "BGE-small-en-v1.5 是一个高效的英文句子嵌入模型，能够将文本转换为语义丰富的向量表示，专门解决文档相似度计算和语义搜索问题。它通过对比学习结合困难负样本挖掘，并采用知识蒸馏技术从大模型中学习，在保持轻量级的同时实现了优异的性能表现。开发者可将其用于构建智能检索系统、文档聚类分析，或作为RAG架构中的编码器，特别适合部署在计算资源有限的环境中探索语义理解应用。",
        "es": "BGE-small-en-v1.5 is a compact English sentence embedding model that converts text into meaningful numerical representations for semantic similarity tasks. It employs contrastive learning with hard negatives and knowledge distillation from larger models, achieving strong performance despite its small size. You can use it for semantic search, clustering similar documents, or as a lightweight encoder in retrieval-augmented generation pipelines, making it ideal for resource-constrained applications."
      },
      "summary_short": {
        "zh": "BGE-small-en-v1.5 是一个高效的英文句子嵌入模型，能够将文本转换为语义丰富的向量表示，专门解决文档相似度计算和语义搜索问题。它通过对比学习结合困难负样本挖掘，并采用知识蒸馏技术从大模型中学习，在保持轻量级的同时实现了优异的性能表现。开发者可将其用于构建智能检索系统、文档聚类分析，或作为RAG架构中的编码器，特别适合部署在计算资源有限的环境中探索语义理解应用。",
        "en": "BGE-small-en-v1.5 is a compact English sentence embedding model that converts text into meaningful numerical representations for semantic similarity tasks. It employs contrastive learning with hard negatives and knowledge distillation from larger models, achieving strong perform…",
        "es": "BGE-small-en-v1.5 is a compact English sentence embedding model that converts text into meaningful numerical representations for semantic similarity tasks. It employs contrastive learning with hard negatives and knowledge distillation from larger models, achieving strong perform…"
      },
      "locales": [
        "en",
        "zh",
        "es"
      ],
      "provider": {
        "name": "deepseek-tri",
        "version": "1.0.0",
        "mode": "json_single"
      },
      "quality": {
        "score": 0.92,
        "fallback": false,
        "length": {
          "en": 501,
          "zh": 188,
          "es": 501
        },
        "warnings": [
          "es_short:0"
        ],
        "accepted_at": "2025-10-11T07:00:49.059Z"
      },
      "stats": {
        "downloads_total": 51419679,
        "likes_total": 472
      },
      "metadata": {
        "license": "N/A",
        "lang": "N/A",
        "categories": {
          "capabilities": [],
          "scenes": [],
          "lifecycle": []
        }
      },
      "created_at": "2025-10-11T07:00:49.059Z",
      "updated_at": "2025-10-11T07:00:49.059Z",
      "first_generated_at": "2025-10-11T07:00:49.059Z",
      "source": "huggingface"
    },
    {
      "canonical_id": "huggingface:Comfy-Org/stable-diffusion-v1-5-archive",
      "promptHash": "sha256:544c8227286dba08690c31ad8c6c0a61801bb664d8e6f22a389bb7112ff2c590",
      "summary_version": 1,
      "status": "qualified",
      "name": "stable-diffusion-v1-5-archive",
      "url": "https://huggingface.co/Comfy-Org/stable-diffusion-v1-5-archive",
      "tags": [
        "diffusion-single-file",
        "comfyui",
        "en",
        "base_model:CompVis/stable-diffusion-v1-4",
        "base_model:finetune:CompVis/stable-diffusion-v1-4",
        "license:creativeml-openrail-m",
        "region:us"
      ],
      "summaries": {
        "en": "Stable Diffusion v1.5 is a latent text-to-image diffusion model that generates high-quality images from text prompts. It improves upon v1.4 with better training and fine-tuning, enabling more coherent and detailed outputs. Technically, it uses a UNet with cross-attention and a CLIP text encoder. You can run it locally via ComfyUI or other interfaces, fine-tune it on custom datasets, or use it for art, design, and prototyping.",
        "zh": "Stable Diffusion v1.5 是一个基于潜在扩散模型的文本生成图像模型，能从文字描述生成高质量图片。相比 v1.4，它通过更优的训练和微调提升了图像的一致性与细节表现。其核心技术是结合交叉注意力机制的 UNet 和 CLIP 文本编码器，将文本语义映射到图像生成过程。你可以通过 ComfyUI 等工具在本地运行，或基于自己的数据集进行微调，应用于艺术创作、设计原型、概念可视化等场景。该模型开源且易于扩展，是探索生成式 AI 的绝佳起点。",
        "es": "Stable Diffusion v1.5 is a latent text-to-image diffusion model that generates high-quality images from text prompts. It improves upon v1.4 with better training and fine-tuning, enabling more coherent and detailed outputs. Technically, it uses a UNet with cross-attention and a CLIP text encoder. You can run it locally via ComfyUI or other interfaces, fine-tune it on custom datasets, or use it for art, design, and prototyping."
      },
      "summary_short": {
        "zh": "Stable Diffusion v1.5 是一个基于潜在扩散模型的文本生成图像模型，能从文字描述生成高质量图片。相比 v1.4，它通过更优的训练和微调提升了图像的一致性与细节表现。其核心技术是结合交叉注意力机制的 UNet 和 CLIP 文本编码器，将文本语义映射到图像生成过程。你可以通过 ComfyUI 等工具在本地运行，或基于自己的数据集进行微调，应用于艺术创作、设计原型、概念可视化等场景。该模型开源且易于扩展，是探索生成式 AI 的绝佳起点。",
        "en": "Stable Diffusion v1.5 is a latent text-to-image diffusion model that generates high-quality images from text prompts. It improves upon v1.4 with better training and fine-tuning, enabling more coherent and detailed outputs. Technically, it uses a UNet with cross-attention and a C…",
        "es": "Stable Diffusion v1.5 is a latent text-to-image diffusion model that generates high-quality images from text prompts. It improves upon v1.4 with better training and fine-tuning, enabling more coherent and detailed outputs. Technically, it uses a UNet with cross-attention and a C…"
      },
      "locales": [
        "en",
        "zh",
        "es"
      ],
      "provider": {
        "name": "deepseek-tri",
        "version": "1.0.0",
        "mode": "json_single"
      },
      "quality": {
        "score": 0.92,
        "fallback": false,
        "length": {
          "en": 429,
          "zh": 227,
          "es": 429
        },
        "warnings": [
          "es_short:0"
        ],
        "accepted_at": "2026-05-28T03:55:55.791Z"
      },
      "stats": {
        "downloads_total": 3000693,
        "likes_total": 100
      },
      "metadata": {
        "license": "N/A",
        "lang": "N/A",
        "categories": {
          "capabilities": [],
          "scenes": [],
          "lifecycle": []
        }
      },
      "created_at": "2026-05-28T03:55:55.791Z",
      "updated_at": "2026-05-28T03:55:55.791Z",
      "first_generated_at": "2026-05-28T03:55:55.791Z",
      "source": "huggingface"
    }
  ],
  "stats": {
    "total": 2,
    "matched_prompt_hash": 2,
    "mismatched_prompt_hash": 4
  }
}
