{
  "schema_version": 1,
  "pipeline_version": "v6",
  "run_id": "data-analysis-2026-04-03-20260403034550.-e5063f54",
  "date": "2026-04-03",
  "source": "huggingface",
  "generated_at": "2026-04-03T03:45:50.552Z",
  "items": [
    {
      "canonical_id": "huggingface:timm/vit_base_patch14_dinov2.lvd142m",
      "promptHash": "sha256:5b1077f4830f36e94b34eadc0339bda2c0a42a26f216e92f1b6bc7ab8117f98e",
      "summary_version": 1,
      "status": "qualified",
      "name": "vit_base_patch14_dinov2.lvd142m",
      "url": "https://huggingface.co/timm/vit_base_patch14_dinov2.lvd142m",
      "tags": [
        "timm",
        "pytorch",
        "safetensors",
        "image-feature-extraction",
        "transformers",
        "arxiv:2304.07193",
        "arxiv:2010.11929",
        "license:apache-2.0",
        "region:us"
      ],
      "summaries": {
        "en": "DINOv2 is a self-supervised vision transformer that learns rich visual representations without manual labeling, addressing the data bottleneck in computer vision. Its key innovation is a self-distillation approach where a student network learns from a teacher network trained on curated image collections, creating robust features that capture semantic hierarchies. Researchers can fine-tune it for tasks like image classification, segmentation, or retrieval using the Hugging Face transformers library, making it ideal for projects with limited labeled data.",
        "zh": "DINOv2是一种自监督视觉Transformer模型，无需人工标注即可学习丰富的视觉表征，解决了计算机视觉领域的数据标注瓶颈。其核心技术采用自蒸馏方法，学生网络通过教师网络在精选图像集上训练得到的特征进行学习，从而生成能捕捉语义层次结构的鲁棒特征。开发者可通过Hugging Face的transformers库轻松微调该模型，应用于图像分类、分割或检索等任务，特别适合标注数据有限的场景，为视觉研究提供高效的基础模型。",
        "es": "DINOv2 is a self-supervised vision transformer that learns rich visual representations without manual labeling, addressing the data bottleneck in computer vision. Its key innovation is a self-distillation approach where a student network learns from a teacher network trained on curated image collections, creating robust features that capture semantic hierarchies. Researchers can fine-tune it for tasks like image classification, segmentation, or retrieval using the Hugging Face transformers library, making it ideal for projects with limited labeled data."
      },
      "summary_short": {
        "zh": "DINOv2是一种自监督视觉Transformer模型，无需人工标注即可学习丰富的视觉表征，解决了计算机视觉领域的数据标注瓶颈。其核心技术采用自蒸馏方法，学生网络通过教师网络在精选图像集上训练得到的特征进行学习，从而生成能捕捉语义层次结构的鲁棒特征。开发者可通过Hugging Face的transformers库轻松微调该模型，应用于图像分类、分割或检索等任务，特别适合标注数据有限的场景，为视觉研究提供高效的基础模型。",
        "en": "DINOv2 is a self-supervised vision transformer that learns rich visual representations without manual labeling, addressing the data bottleneck in computer vision. Its key innovation is a self-distillation approach where a student network learns from a teacher network trained on …",
        "es": "DINOv2 is a self-supervised vision transformer that learns rich visual representations without manual labeling, addressing the data bottleneck in computer vision. Its key innovation is a self-distillation approach where a student network learns from a teacher network trained on …"
      },
      "locales": [
        "en",
        "zh",
        "es"
      ],
      "provider": {
        "name": "deepseek-tri",
        "version": "1.0.0",
        "mode": "json_single"
      },
      "quality": {
        "score": 0.92,
        "fallback": false,
        "length": {
          "en": 559,
          "zh": 211,
          "es": 559
        },
        "warnings": [
          "es_short:0"
        ],
        "accepted_at": "2026-04-03T03:40:53.220Z"
      },
      "stats": {
        "downloads_total": 2637080,
        "likes_total": 9
      },
      "metadata": {
        "license": "N/A",
        "lang": "N/A",
        "categories": {
          "capabilities": [],
          "scenes": [],
          "lifecycle": []
        }
      },
      "created_at": "2026-04-03T03:40:53.220Z",
      "updated_at": "2026-04-03T03:40:53.220Z",
      "first_generated_at": "2026-04-03T03:40:53.220Z",
      "source": "huggingface"
    }
  ],
  "stats": {
    "total": 1,
    "matched_prompt_hash": 1,
    "mismatched_prompt_hash": 5
  }
}
