{
  "schema_version": 1,
  "pipeline_version": "v6",
  "run_id": "data-analysis-2026-04-02-20260402034521.-28fc448e",
  "date": "2026-04-02",
  "source": "huggingface",
  "generated_at": "2026-04-02T03:45:21.030Z",
  "items": [
    {
      "canonical_id": "huggingface:facebook/sam3",
      "promptHash": "sha256:b33500cfa14c4e7c3f98610b37f600b97338c960abf28c18a0c69ed98864a3e3",
      "summary_version": 1,
      "status": "qualified",
      "name": "sam3",
      "url": "https://huggingface.co/facebook/sam3",
      "tags": [
        "transformers",
        "safetensors",
        "sam3_video",
        "feature-extraction",
        "sam3",
        "mask-generation",
        "en",
        "license:other",
        "endpoints_compatible",
        "deploy:azure",
        "region:us"
      ],
      "summaries": {
        "en": "SAM3 is a video segmentation model that automatically identifies and tracks objects across video frames, solving the labor-intensive task of manual video annotation. It builds on the SAM architecture by incorporating temporal consistency mechanisms, enabling it to maintain object identity across frames even with occlusions or motion blur. Researchers can use it for video analysis tasks like activity recognition or autonomous driving simulations by feeding video clips and receiving frame-by-frame segmentation masks.",
        "zh": "SAM3是一个视频分割模型，能够自动识别并跟踪视频中的物体，解决了传统手动标注视频的繁琐问题。它在SAM架构基础上引入了时序一致性机制，通过跨帧特征关联保持物体身份连续性，即使遇到遮挡或运动模糊也能稳定追踪。研究人员可将视频片段输入模型，获取逐帧的分割掩码，用于行为分析、自动驾驶模拟等场景，为动态视觉理解提供高效工具。",
        "es": "SAM3 is a video segmentation model that automatically identifies and tracks objects across video frames, solving the labor-intensive task of manual video annotation. It builds on the SAM architecture by incorporating temporal consistency mechanisms, enabling it to maintain object identity across frames even with occlusions or motion blur. Researchers can use it for video analysis tasks like activity recognition or autonomous driving simulations by feeding video clips and receiving frame-by-frame segmentation masks."
      },
      "summary_short": {
        "zh": "SAM3是一个视频分割模型，能够自动识别并跟踪视频中的物体，解决了传统手动标注视频的繁琐问题。它在SAM架构基础上引入了时序一致性机制，通过跨帧特征关联保持物体身份连续性，即使遇到遮挡或运动模糊也能稳定追踪。研究人员可将视频片段输入模型，获取逐帧的分割掩码，用于行为分析、自动驾驶模拟等场景，为动态视觉理解提供高效工具。",
        "en": "SAM3 is a video segmentation model that automatically identifies and tracks objects across video frames, solving the labor-intensive task of manual video annotation. It builds on the SAM architecture by incorporating temporal consistency mechanisms, enabling it to maintain objec…",
        "es": "SAM3 is a video segmentation model that automatically identifies and tracks objects across video frames, solving the labor-intensive task of manual video annotation. It builds on the SAM architecture by incorporating temporal consistency mechanisms, enabling it to maintain objec…"
      },
      "locales": [
        "en",
        "zh",
        "es"
      ],
      "provider": {
        "name": "deepseek-tri",
        "version": "1.0.0",
        "mode": "json_single"
      },
      "quality": {
        "score": 0.92,
        "fallback": false,
        "length": {
          "en": 520,
          "zh": 160,
          "es": 520
        },
        "warnings": [
          "es_short:0"
        ],
        "accepted_at": "2026-04-02T03:40:34.514Z"
      },
      "stats": {
        "downloads_total": 2514171,
        "likes_total": 1815
      },
      "metadata": {
        "license": "N/A",
        "lang": "N/A",
        "categories": {
          "capabilities": [],
          "scenes": [],
          "lifecycle": []
        }
      },
      "created_at": "2026-04-02T03:40:34.514Z",
      "updated_at": "2026-04-02T03:40:34.514Z",
      "first_generated_at": "2026-04-02T03:40:34.514Z",
      "source": "huggingface"
    }
  ],
  "stats": {
    "total": 1,
    "matched_prompt_hash": 1,
    "mismatched_prompt_hash": 5
  }
}
