{
  "schema_version": 1,
  "pipeline_version": "v6",
  "run_id": "data-analysis-2026-05-01-20260501040021.-b4d3411a",
  "date": "2026-05-01",
  "source": "huggingface",
  "generated_at": "2026-05-01T04:00:21.310Z",
  "items": [
    {
      "canonical_id": "huggingface:Qwen/Qwen3-VL-2B-Instruct",
      "promptHash": "sha256:23dec1cb849aab00633aff4bbf31be36b2392c5b9a33ca0af2e1b5502e620a13",
      "summary_version": 1,
      "status": "qualified",
      "name": "Qwen3-VL-2B-Instruct",
      "url": "https://huggingface.co/Qwen/Qwen3-VL-2B-Instruct",
      "tags": [
        "transformers",
        "safetensors",
        "qwen3_vl",
        "image-text-to-text",
        "conversational",
        "arxiv:2505.09388",
        "arxiv:2502.13923",
        "arxiv:2409.12191",
        "arxiv:2308.12966",
        "license:apache-2.0",
        "endpoints_compatible",
        "deploy:azure",
        "region:us"
      ],
      "summaries": {
        "en": "Qwen3-VL-2B-Instruct is a lightweight 2-billion-parameter vision-language model that enables conversational AI to understand and reason about both images and text simultaneously. Its technical innovation lies in efficient multimodal fusion architecture that maintains strong reasoning capabilities while being small enough for edge deployment. Developers can use it through Hugging Face Transformers for applications like visual question answering, image captioning, or building interactive AI assistants that process visual content alongside text inputs.",
        "zh": "Qwen3-VL-2B-Instruct 是一个轻量级的 20 亿参数视觉语言模型，能够同时理解图像和文本，实现多模态对话与推理。其技术核心在于高效的跨模态融合架构，在保持较强推理能力的同时，模型尺寸足够小，适合在资源受限的边缘设备上部署。开发者可通过 Hugging Face Transformers 直接调用该模型，应用于视觉问答、图像描述生成，或构建能够结合视觉内容与文本输入的交互式 AI 助手，为实际场景提供灵活的多模态解决方案。",
        "es": "Qwen3-VL-2B-Instruct is a lightweight 2-billion-parameter vision-language model that enables conversational AI to understand and reason about both images and text simultaneously. Its technical innovation lies in efficient multimodal fusion architecture that maintains strong reasoning capabilities while being small enough for edge deployment. Developers can use it through Hugging Face Transformers for applications like visual question answering, image captioning, or building interactive AI assistants that process visual content alongside text inputs."
      },
      "summary_short": {
        "zh": "Qwen3-VL-2B-Instruct 是一个轻量级的 20 亿参数视觉语言模型，能够同时理解图像和文本，实现多模态对话与推理。其技术核心在于高效的跨模态融合架构，在保持较强推理能力的同时，模型尺寸足够小，适合在资源受限的边缘设备上部署。开发者可通过 Hugging Face Transformers 直接调用该模型，应用于视觉问答、图像描述生成，或构建能够结合视觉内容与文本输入的交互式 AI 助手，为实际场景提供灵活的多模态解决方案。",
        "en": "Qwen3-VL-2B-Instruct is a lightweight 2-billion-parameter vision-language model that enables conversational AI to understand and reason about both images and text simultaneously. Its technical innovation lies in efficient multimodal fusion architecture that maintains strong reas…",
        "es": "Qwen3-VL-2B-Instruct is a lightweight 2-billion-parameter vision-language model that enables conversational AI to understand and reason about both images and text simultaneously. Its technical innovation lies in efficient multimodal fusion architecture that maintains strong reas…"
      },
      "locales": [
        "en",
        "zh",
        "es"
      ],
      "provider": {
        "name": "deepseek-tri",
        "version": "1.0.0",
        "mode": "json_single"
      },
      "quality": {
        "score": 0.92,
        "fallback": false,
        "length": {
          "en": 555,
          "zh": 221,
          "es": 555
        },
        "warnings": [
          "es_short:0"
        ],
        "accepted_at": "2026-02-14T03:26:07.853Z"
      },
      "stats": {
        "downloads_total": 185757734,
        "likes_total": 382
      },
      "metadata": {
        "license": "N/A",
        "lang": "N/A",
        "categories": {
          "capabilities": [],
          "scenes": [],
          "lifecycle": []
        }
      },
      "created_at": "2026-02-14T03:26:07.853Z",
      "updated_at": "2026-02-14T03:26:07.853Z",
      "first_generated_at": "2026-02-14T03:26:07.853Z",
      "source": "huggingface"
    }
  ],
  "stats": {
    "total": 1,
    "matched_prompt_hash": 1,
    "mismatched_prompt_hash": 4
  }
}
