{
  "schema_version": 1,
  "pipeline_version": "v6",
  "run_id": "data-analysis-2025-11-21-20251121030238.-2d4f1178",
  "date": "2025-11-21",
  "source": "github",
  "generated_at": "2025-11-21T03:02:38.112Z",
  "items": [],
  "stats": {
    "total": 0,
    "matched_prompt_hash": 0,
    "mismatched_prompt_hash": 5
  }
}
