{
  "schema_version": 1,
  "pipeline_version": "v6",
  "run_id": "data-analysis-2026-08-29-20260829025435.-0c9a1528",
  "date": "2026-08-29",
  "source": "github",
  "generated_at": "2026-08-29T02:54:35.752Z",
  "items": [
    {
      "canonical_id": "github:codecrafters-io/build-your-own-x",
      "promptHash": "sha256:f0cc453408c52590c9c95e035339467922e740d334a51760d2024391693233ee",
      "summary_version": 1,
      "status": "qualified",
      "name": "build-your-own-x",
      "url": "https://github.com/codecrafters-io/build-your-own-x",
      "tags": [
        "awesome-list",
        "free",
        "programming",
        "tutorial-code",
        "tutorial-exercises",
        "tutorials"
      ],
      "summaries": {
        "en": "Build-Your-Own-X is a curated collection of tutorials that teaches programming by recreating technologies from scratch, helping developers understand system internals through hands-on implementation. Its technical insight lies in breaking down complex systems into learnable components, demonstrating how foundational concepts combine to create sophisticated tools. You can use it to build anything from databases to games, gaining practical skills while exploring how your favorite tools work under the hood—perfect for deepening your programming knowledge through active creation.",
        "zh": "Build-Your-Own-X 是一个精心编排的教程集合，通过从零开始复现各种技术来教授编程，帮助开发者通过动手实践理解系统内部原理。其核心方法是将复杂系统分解为可学习的组件，展示基础概念如何组合成复杂工具的技术思路。你可以用它构建从数据库到游戏的各种项目，在探索常用工具底层原理的同时获得实用技能——这种“边做边学”的方式非常适合想要通过主动创造来深化编程理解的开发者，为技术成长提供了一条清晰的实践路径。",
        "es": "Build-Your-Own-X is a curated collection of tutorials that teaches programming by recreating technologies from scratch, helping developers understand system internals through hands-on implementation. Its technical insight lies in breaking down complex systems into learnable components, demonstrating how foundational concepts combine to create sophisticated tools. You can use it to build anything from databases to games, gaining practical skills while exploring how your favorite tools work under the hood—perfect for deepening your programming knowledge through active creation."
      },
      "summary_short": {
        "zh": "Build-Your-Own-X 是一个精心编排的教程集合，通过从零开始复现各种技术来教授编程，帮助开发者通过动手实践理解系统内部原理。其核心方法是将复杂系统分解为可学习的组件，展示基础概念如何组合成复杂工具的技术思路。你可以用它构建从数据库到游戏的各种项目，在探索常用工具底层原理的同时获得实用技能——这种“边做边学”的方式非常适合想要通过主动创造来深化编程理解的开发者，为技术成长提供了一条清晰的实践路径。",
        "en": "Build-Your-Own-X is a curated collection of tutorials that teaches programming by recreating technologies from scratch, helping developers understand system internals through hands-on implementation. Its technical insight lies in breaking down complex systems into learnable comp…",
        "es": "Build-Your-Own-X is a curated collection of tutorials that teaches programming by recreating technologies from scratch, helping developers understand system internals through hands-on implementation. Its technical insight lies in breaking down complex systems into learnable comp…"
      },
      "locales": [
        "en",
        "zh",
        "es"
      ],
      "provider": {
        "name": "deepseek-tri",
        "version": "1.0.0",
        "mode": "json_single"
      },
      "quality": {
        "score": 0.92,
        "fallback": false,
        "length": {
          "en": 582,
          "zh": 205,
          "es": 582
        },
        "warnings": [
          "es_short:0"
        ],
        "accepted_at": "2025-11-07T18:07:13.509Z"
      },
      "stats": {
        "stars": 543713,
        "forks": 51261,
        "issues": 639
      },
      "metadata": {
        "license": "N/A",
        "lang": "Markdown",
        "categories": {
          "capabilities": [],
          "scenes": [],
          "lifecycle": []
        }
      },
      "created_at": "2025-11-07T18:07:13.509Z",
      "updated_at": "2025-11-07T18:07:13.509Z",
      "first_generated_at": "2025-11-07T18:07:13.509Z",
      "source": "github"
    }
  ],
  "stats": {
    "total": 1,
    "matched_prompt_hash": 1,
    "mismatched_prompt_hash": 4
  }
}
