{
  "schema_version": 1,
  "pipeline_version": "v6",
  "run_id": "data-analysis-2026-09-03-20260903041851.-bda74f3d",
  "date": "2026-09-03",
  "source": "huggingface",
  "generated_at": "2026-09-03T04:18:51.449Z",
  "items": [
    {
      "canonical_id": "huggingface:BAAI/bge-small-en-v1.5",
      "promptHash": "sha256:5ed6cb6fb5aa934e43677a957100253b7a8572eaddddcf9750de5c99dd45f1f3",
      "summary_version": 1,
      "status": "qualified",
      "name": "bge-small-en-v1.5",
      "url": "https://huggingface.co/BAAI/bge-small-en-v1.5",
      "tags": [
        "sentence-transformers",
        "pytorch",
        "onnx",
        "safetensors",
        "bert",
        "feature-extraction",
        "sentence-similarity",
        "transformers",
        "mteb",
        "en",
        "arxiv:2401.03462",
        "arxiv:2312.15503",
        "arxiv:2311.13534",
        "arxiv:2310.07554",
        "arxiv:2309.07597",
        "license:mit",
        "model-index",
        "text-embeddings-inference",
        "endpoints_compatible",
        "deploy:sagemaker",
        "deploy:azure",
        "region:us"
      ],
      "summaries": {
        "en": "BGE-small-en-v1.5 is a compact English sentence embedding model that converts text into meaningful numerical representations for semantic similarity tasks. It employs contrastive learning with hard negatives and knowledge distillation from larger models, achieving strong performance despite its small size. You can use it for semantic search, clustering similar documents, or as a lightweight encoder in retrieval-augmented generation pipelines, making it ideal for resource-constrained applications.",
        "zh": "BGE-small-en-v1.5 是一个高效的英文句子嵌入模型，能够将文本转换为语义丰富的向量表示，专门解决文档相似度计算和语义搜索问题。它通过对比学习结合困难负样本挖掘，并采用知识蒸馏技术从大模型中学习，在保持轻量级的同时实现了优异的性能表现。开发者可将其用于构建智能检索系统、文档聚类分析，或作为RAG架构中的编码器，特别适合部署在计算资源有限的环境中探索语义理解应用。",
        "es": "BGE-small-en-v1.5 is a compact English sentence embedding model that converts text into meaningful numerical representations for semantic similarity tasks. It employs contrastive learning with hard negatives and knowledge distillation from larger models, achieving strong performance despite its small size. You can use it for semantic search, clustering similar documents, or as a lightweight encoder in retrieval-augmented generation pipelines, making it ideal for resource-constrained applications."
      },
      "summary_short": {
        "zh": "BGE-small-en-v1.5 是一个高效的英文句子嵌入模型，能够将文本转换为语义丰富的向量表示，专门解决文档相似度计算和语义搜索问题。它通过对比学习结合困难负样本挖掘，并采用知识蒸馏技术从大模型中学习，在保持轻量级的同时实现了优异的性能表现。开发者可将其用于构建智能检索系统、文档聚类分析，或作为RAG架构中的编码器，特别适合部署在计算资源有限的环境中探索语义理解应用。",
        "en": "BGE-small-en-v1.5 is a compact English sentence embedding model that converts text into meaningful numerical representations for semantic similarity tasks. It employs contrastive learning with hard negatives and knowledge distillation from larger models, achieving strong perform…",
        "es": "BGE-small-en-v1.5 is a compact English sentence embedding model that converts text into meaningful numerical representations for semantic similarity tasks. It employs contrastive learning with hard negatives and knowledge distillation from larger models, achieving strong perform…"
      },
      "locales": [
        "en",
        "zh",
        "es"
      ],
      "provider": {
        "name": "deepseek-tri",
        "version": "1.0.0",
        "mode": "json_single"
      },
      "quality": {
        "score": 0.92,
        "fallback": false,
        "length": {
          "en": 501,
          "zh": 188,
          "es": 501
        },
        "warnings": [
          "es_short:0"
        ],
        "accepted_at": "2025-10-11T07:00:49.059Z"
      },
      "stats": {
        "downloads_total": 66280213,
        "likes_total": 542
      },
      "metadata": {
        "license": "N/A",
        "lang": "N/A",
        "categories": {
          "capabilities": [],
          "scenes": [],
          "lifecycle": []
        }
      },
      "created_at": "2025-10-11T07:00:49.059Z",
      "updated_at": "2025-10-11T07:00:49.059Z",
      "first_generated_at": "2025-10-11T07:00:49.059Z",
      "source": "huggingface"
    },
    {
      "canonical_id": "huggingface:Qwen/Qwen3-Embedding-4B",
      "promptHash": "sha256:63469c73131d9db203320b4e2d401400b22349167825f43295b3117faed23fac",
      "summary_version": 1,
      "status": "qualified",
      "name": "Qwen3-Embedding-4B",
      "url": "https://huggingface.co/Qwen/Qwen3-Embedding-4B",
      "tags": [
        "sentence-transformers",
        "safetensors",
        "qwen3",
        "text-generation",
        "transformers",
        "sentence-similarity",
        "feature-extraction",
        "text-embeddings-inference",
        "arxiv:2506.05176",
        "base_model:Qwen/Qwen3-4B-Base",
        "base_model:finetune:Qwen/Qwen3-4B-Base",
        "license:apache-2.0",
        "endpoints_compatible",
        "region:us"
      ],
      "summaries": {
        "en": "Qwen3-Embedding-4B turns the Qwen3-4B base model into a high-performance text-embedding engine, solving retrieval, RAG, and semantic-search problems with richer context understanding. Its key design insight is unifying token and sentence-level embeddings via a decoder-only architecture, enabling flexible embeddings without a separate encoder. You can load it through Sentence-Transformers or deploy with Text-Embeddings-Inference, then use it to embed long documents or queries and compare them for search, clustering, or classification tasks.",
        "zh": "Qwen3-Embedding-4B是在Qwen3-4B基座上微调得到的文本嵌入模型，专为语义检索、RAG和向量搜索设计，能以更丰富的语义表达处理长文本。其技术亮点是采用解码器架构，同时支持词元级与句子级嵌入，无需额外编码器即可获得高质量向量。接入方式很简便：既可用Sentence-Transformers加载，也可用Text-Embeddings-Inference部署。你可以用它把知识库文档切成片段并向量化，再借助余弦相似度实现精准召回，满足搜索、聚类、分类等实际需求。",
        "es": "Qwen3-Embedding-4B turns the Qwen3-4B base model into a high-performance text-embedding engine, solving retrieval, RAG, and semantic-search problems with richer context understanding. Its key design insight is unifying token and sentence-level embeddings via a decoder-only architecture, enabling flexible embeddings without a separate encoder. You can load it through Sentence-Transformers or deploy with Text-Embeddings-Inference, then use it to embed long documents or queries and compare them for search, clustering, or classification tasks."
      },
      "summary_short": {
        "zh": "Qwen3-Embedding-4B是在Qwen3-4B基座上微调得到的文本嵌入模型，专为语义检索、RAG和向量搜索设计，能以更丰富的语义表达处理长文本。其技术亮点是采用解码器架构，同时支持词元级与句子级嵌入，无需额外编码器即可获得高质量向量。接入方式很简便：既可用Sentence-Transformers加载，也可用Text-Embeddings-Inference部署。你可以用它把知识库文档切成片段并向量化，再借助余弦相似度实现精准召回，满足搜索、聚类、分类等实际需求。",
        "en": "Qwen3-Embedding-4B turns the Qwen3-4B base model into a high-performance text-embedding engine, solving retrieval, RAG, and semantic-search problems with richer context understanding. Its key design insight is unifying token and sentence-level embeddings via a decoder-only archi…",
        "es": "Qwen3-Embedding-4B turns the Qwen3-4B base model into a high-performance text-embedding engine, solving retrieval, RAG, and semantic-search problems with richer context understanding. Its key design insight is unifying token and sentence-level embeddings via a decoder-only archi…"
      },
      "locales": [
        "en",
        "zh",
        "es"
      ],
      "provider": {
        "name": "deepseek-tri",
        "version": "1.0.0",
        "mode": "json_single"
      },
      "quality": {
        "score": 0.92,
        "fallback": false,
        "length": {
          "en": 545,
          "zh": 239,
          "es": 545
        },
        "warnings": [
          "es_short:0"
        ],
        "accepted_at": "2026-09-03T04:12:38.440Z"
      },
      "stats": {
        "downloads_total": 3223721,
        "likes_total": 317
      },
      "metadata": {
        "license": "N/A",
        "lang": "N/A",
        "categories": {
          "capabilities": [],
          "scenes": [],
          "lifecycle": []
        }
      },
      "created_at": "2026-09-03T04:12:38.440Z",
      "updated_at": "2026-09-03T04:12:38.440Z",
      "first_generated_at": "2026-09-03T04:12:38.440Z",
      "source": "huggingface"
    }
  ],
  "stats": {
    "total": 2,
    "matched_prompt_hash": 2,
    "mismatched_prompt_hash": 4
  }
}
