{
  "schema_version": 1,
  "pipeline_version": "v6",
  "run_id": "data-analysis-2026-08-13-20260813034311.-aabfaf28",
  "date": "2026-08-13",
  "source": "github",
  "generated_at": "2026-08-13T03:43:11.395Z",
  "items": [
    {
      "canonical_id": "github:msitarzewski/agency-agents",
      "promptHash": "sha256:39afd130396ec0d4d8132a959ef72932eea62911d8c8f7009d769c387bfd737f",
      "summary_version": 1,
      "status": "qualified",
      "name": "agency-agents",
      "url": "https://github.com/msitarzewski/agency-agents",
      "tags": [],
      "summaries": {
        "en": "Agency-agents is an open-source framework that simplifies building multi-agent AI systems by providing pre-configured specialized agents, addressing the complexity of coordinating diverse AI capabilities. Its key insight is structuring agents with distinct personalities and processes, enabling modular collaboration where each agent handles specific tasks like frontend development or content moderation. Developers can deploy these agents via the provided API, customize existing agents for new domains, or combine them to create complex workflows, making it practical for automating multi-step projects requiring varied expertise.",
        "zh": "Agency-agents是一个开源框架，旨在简化多智能体AI系统的构建。它通过提供预配置的专用智能体，解决协调多样化AI能力的复杂性。每个智能体具有独特的个性和处理流程，支持模块化协作，适用于前端开发、内容审核等特定任务。开发者可通过API快速部署智能体，定制现有智能体以适应新领域，或组合它们构建复杂工作流。该框架适用于自动化多步骤、多专业知识项目，鼓励用户创建智能体团队解决实际问题。",
        "es": "Agency-agents is an open-source framework that simplifies building multi-agent AI systems by providing pre-configured specialized agents, addressing the complexity of coordinating diverse AI capabilities. Its key insight is structuring agents with distinct personalities and processes, enabling modular collaboration where each agent handles specific tasks like frontend development or content moderation. Developers can deploy these agents via the provided API, customize existing agents for new domains, or combine them to create complex workflows, making it practical for automating multi-step projects requiring varied expertise."
      },
      "summary_short": {
        "zh": "Agency-agents是一个开源框架，旨在简化多智能体AI系统的构建。它通过提供预配置的专用智能体，解决协调多样化AI能力的复杂性。每个智能体具有独特的个性和处理流程，支持模块化协作，适用于前端开发、内容审核等特定任务。开发者可通过API快速部署智能体，定制现有智能体以适应新领域，或组合它们构建复杂工作流。该框架适用于自动化多步骤、多专业知识项目，鼓励用户创建智能体团队解决实际问题。",
        "en": "Agency-agents is an open-source framework that simplifies building multi-agent AI systems by providing pre-configured specialized agents, addressing the complexity of coordinating diverse AI capabilities. Its key insight is structuring agents with distinct personalities and proc…",
        "es": "Agency-agents is an open-source framework that simplifies building multi-agent AI systems by providing pre-configured specialized agents, addressing the complexity of coordinating diverse AI capabilities. Its key insight is structuring agents with distinct personalities and proc…"
      },
      "locales": [
        "en",
        "zh",
        "es"
      ],
      "provider": {
        "name": "deepseek-tri",
        "version": "1.0.0",
        "mode": "json_single"
      },
      "quality": {
        "score": 0.92,
        "fallback": false,
        "length": {
          "en": 633,
          "zh": 195,
          "es": 633
        },
        "warnings": [
          "zh_trimmed:192->180",
          "es_short:0"
        ],
        "accepted_at": "2026-03-05T03:28:41.987Z"
      },
      "stats": {
        "stars": 144663,
        "forks": 23428,
        "issues": 130
      },
      "metadata": {
        "license": "MIT",
        "lang": "Shell",
        "categories": {
          "capabilities": [],
          "scenes": [],
          "lifecycle": []
        }
      },
      "created_at": "2026-03-05T03:28:41.987Z",
      "updated_at": "2026-03-05T03:28:41.987Z",
      "first_generated_at": "2026-03-05T03:28:41.987Z",
      "source": "github"
    },
    {
      "canonical_id": "github:codecrafters-io/build-your-own-x",
      "promptHash": "sha256:f0cc453408c52590c9c95e035339467922e740d334a51760d2024391693233ee",
      "summary_version": 1,
      "status": "qualified",
      "name": "build-your-own-x",
      "url": "https://github.com/codecrafters-io/build-your-own-x",
      "tags": [
        "awesome-list",
        "free",
        "programming",
        "tutorial-code",
        "tutorial-exercises",
        "tutorials"
      ],
      "summaries": {
        "en": "Build-Your-Own-X is a curated collection of tutorials that teaches programming by recreating technologies from scratch, helping developers understand system internals through hands-on implementation. Its technical insight lies in breaking down complex systems into learnable components, demonstrating how foundational concepts combine to create sophisticated tools. You can use it to build anything from databases to games, gaining practical skills while exploring how your favorite tools work under the hood—perfect for deepening your programming knowledge through active creation.",
        "zh": "Build-Your-Own-X 是一个精心编排的教程集合，通过从零开始复现各种技术来教授编程，帮助开发者通过动手实践理解系统内部原理。其核心方法是将复杂系统分解为可学习的组件，展示基础概念如何组合成复杂工具的技术思路。你可以用它构建从数据库到游戏的各种项目，在探索常用工具底层原理的同时获得实用技能——这种“边做边学”的方式非常适合想要通过主动创造来深化编程理解的开发者，为技术成长提供了一条清晰的实践路径。",
        "es": "Build-Your-Own-X is a curated collection of tutorials that teaches programming by recreating technologies from scratch, helping developers understand system internals through hands-on implementation. Its technical insight lies in breaking down complex systems into learnable components, demonstrating how foundational concepts combine to create sophisticated tools. You can use it to build anything from databases to games, gaining practical skills while exploring how your favorite tools work under the hood—perfect for deepening your programming knowledge through active creation."
      },
      "summary_short": {
        "zh": "Build-Your-Own-X 是一个精心编排的教程集合，通过从零开始复现各种技术来教授编程，帮助开发者通过动手实践理解系统内部原理。其核心方法是将复杂系统分解为可学习的组件，展示基础概念如何组合成复杂工具的技术思路。你可以用它构建从数据库到游戏的各种项目，在探索常用工具底层原理的同时获得实用技能——这种“边做边学”的方式非常适合想要通过主动创造来深化编程理解的开发者，为技术成长提供了一条清晰的实践路径。",
        "en": "Build-Your-Own-X is a curated collection of tutorials that teaches programming by recreating technologies from scratch, helping developers understand system internals through hands-on implementation. Its technical insight lies in breaking down complex systems into learnable comp…",
        "es": "Build-Your-Own-X is a curated collection of tutorials that teaches programming by recreating technologies from scratch, helping developers understand system internals through hands-on implementation. Its technical insight lies in breaking down complex systems into learnable comp…"
      },
      "locales": [
        "en",
        "zh",
        "es"
      ],
      "provider": {
        "name": "deepseek-tri",
        "version": "1.0.0",
        "mode": "json_single"
      },
      "quality": {
        "score": 0.92,
        "fallback": false,
        "length": {
          "en": 582,
          "zh": 205,
          "es": 582
        },
        "warnings": [
          "es_short:0"
        ],
        "accepted_at": "2025-11-07T18:07:13.509Z"
      },
      "stats": {
        "stars": 539175,
        "forks": 50916,
        "issues": 624
      },
      "metadata": {
        "license": "N/A",
        "lang": "Markdown",
        "categories": {
          "capabilities": [],
          "scenes": [],
          "lifecycle": []
        }
      },
      "created_at": "2025-11-07T18:07:13.509Z",
      "updated_at": "2025-11-07T18:07:13.509Z",
      "first_generated_at": "2025-11-07T18:07:13.509Z",
      "source": "github"
    }
  ],
  "stats": {
    "total": 2,
    "matched_prompt_hash": 2,
    "mismatched_prompt_hash": 3
  }
}
