{
  "schema_version": 1,
  "pipeline_version": "v6",
  "run_id": "data-analysis-2026-01-14-20260114032004.-3773a51c",
  "date": "2026-01-14",
  "source": "huggingface",
  "generated_at": "2026-01-14T03:20:04.075Z",
  "items": [
    {
      "canonical_id": "huggingface:autogluon/chronos-2-small",
      "promptHash": "sha256:d98419b660da5693ef37a8d1cd297a7211ca5b4bafc889bf978d4b5e2f8af3df",
      "summary_version": 1,
      "status": "qualified",
      "name": "chronos-2-small",
      "url": "https://huggingface.co/autogluon/chronos-2-small",
      "tags": [
        "chronos-forecasting",
        "safetensors",
        "t5",
        "time series",
        "forecasting",
        "foundation models",
        "pretrained models",
        "time-series-forecasting",
        "dataset:autogluon/chronos_datasets",
        "dataset:Salesforce/GiftEvalPretrain",
        "arxiv:2510.15821",
        "license:apache-2.0",
        "region:us"
      ],
      "summaries": {
        "en": "Chronos-2-small is a lightweight time series forecasting model that enables accurate predictions without extensive historical data, making forecasting accessible for resource-constrained applications. It employs a T5-based architecture that treats forecasting as a language modeling task, converting numerical time series into token sequences for flexible handling of diverse patterns. Users can fine-tune it on custom datasets via Hugging Face or apply it directly for tasks like sales forecasting, anomaly detection, or IoT sensor analysis, with its small size allowing deployment on edge devices.",
        "zh": "Chronos-2-small 是一个轻量级时间序列预测模型，它能在历史数据有限的情况下提供准确预测，降低了资源受限场景的应用门槛。该模型基于T5架构，创新地将预测任务转化为语言建模问题，通过将数值序列转换为词元来处理多样化模式，这种设计增强了模型的灵活性和泛化能力。用户可通过Hugging Face平台微调自定义数据集，或直接应用于销售预测、异常检测和物联网传感器分析等场景，其紧凑的体量特别适合在边缘设备上部署实验。",
        "es": "Chronos-2-small is a lightweight time series forecasting model that enables accurate predictions without extensive historical data, making forecasting accessible for resource-constrained applications. It employs a T5-based architecture that treats forecasting as a language modeling task, converting numerical time series into token sequences for flexible handling of diverse patterns. Users can fine-tune it on custom datasets via Hugging Face or apply it directly for tasks like sales forecasting, anomaly detection, or IoT sensor analysis, with its small size allowing deployment on edge devices."
      },
      "summary_short": {
        "zh": "Chronos-2-small 是一个轻量级时间序列预测模型，它能在历史数据有限的情况下提供准确预测，降低了资源受限场景的应用门槛。该模型基于T5架构，创新地将预测任务转化为语言建模问题，通过将数值序列转换为词元来处理多样化模式，这种设计增强了模型的灵活性和泛化能力。用户可通过Hugging Face平台微调自定义数据集，或直接应用于销售预测、异常检测和物联网传感器分析等场景，其紧凑的体量特别适合在边缘设备上部署实验。",
        "en": "Chronos-2-small is a lightweight time series forecasting model that enables accurate predictions without extensive historical data, making forecasting accessible for resource-constrained applications. It employs a T5-based architecture that treats forecasting as a language model…",
        "es": "Chronos-2-small is a lightweight time series forecasting model that enables accurate predictions without extensive historical data, making forecasting accessible for resource-constrained applications. It employs a T5-based architecture that treats forecasting as a language model…"
      },
      "locales": [
        "en",
        "zh",
        "es"
      ],
      "provider": {
        "name": "deepseek-tri",
        "version": "1.0.0",
        "mode": "json_single"
      },
      "quality": {
        "score": 0.92,
        "fallback": false,
        "length": {
          "en": 599,
          "zh": 211,
          "es": 599
        },
        "warnings": [
          "es_short:0"
        ],
        "accepted_at": "2026-01-14T03:17:07.750Z"
      },
      "stats": {
        "downloads_total": 2464902,
        "likes_total": 0
      },
      "metadata": {
        "license": "N/A",
        "lang": "N/A",
        "categories": {
          "capabilities": [],
          "scenes": [],
          "lifecycle": []
        }
      },
      "created_at": "2026-01-14T03:17:07.750Z",
      "updated_at": "2026-01-14T03:17:07.750Z",
      "first_generated_at": "2026-01-14T03:17:07.750Z",
      "source": "huggingface"
    }
  ],
  "stats": {
    "total": 1,
    "matched_prompt_hash": 1,
    "mismatched_prompt_hash": 5
  }
}
