{
  "schema_version": 1,
  "pipeline_version": "v6",
  "run_id": "data-analysis-2026-06-16-20260616040404.-fb4d6280",
  "date": "2026-06-16",
  "source": "huggingface",
  "generated_at": "2026-06-16T04:04:04.418Z",
  "items": [
    {
      "canonical_id": "huggingface:BAAI/bge-small-en-v1.5",
      "promptHash": "sha256:5ed6cb6fb5aa934e43677a957100253b7a8572eaddddcf9750de5c99dd45f1f3",
      "summary_version": 1,
      "status": "qualified",
      "name": "bge-small-en-v1.5",
      "url": "https://huggingface.co/BAAI/bge-small-en-v1.5",
      "tags": [
        "sentence-transformers",
        "pytorch",
        "onnx",
        "safetensors",
        "bert",
        "feature-extraction",
        "sentence-similarity",
        "transformers",
        "mteb",
        "en",
        "arxiv:2401.03462",
        "arxiv:2312.15503",
        "arxiv:2311.13534",
        "arxiv:2310.07554",
        "arxiv:2309.07597",
        "license:mit",
        "model-index",
        "text-embeddings-inference",
        "endpoints_compatible",
        "deploy:azure",
        "region:us"
      ],
      "summaries": {
        "en": "BGE-small-en-v1.5 is a compact English sentence embedding model that converts text into meaningful numerical representations for semantic similarity tasks. It employs contrastive learning with hard negatives and knowledge distillation from larger models, achieving strong performance despite its small size. You can use it for semantic search, clustering similar documents, or as a lightweight encoder in retrieval-augmented generation pipelines, making it ideal for resource-constrained applications.",
        "zh": "BGE-small-en-v1.5 是一个高效的英文句子嵌入模型，能够将文本转换为语义丰富的向量表示，专门解决文档相似度计算和语义搜索问题。它通过对比学习结合困难负样本挖掘，并采用知识蒸馏技术从大模型中学习，在保持轻量级的同时实现了优异的性能表现。开发者可将其用于构建智能检索系统、文档聚类分析，或作为RAG架构中的编码器，特别适合部署在计算资源有限的环境中探索语义理解应用。",
        "es": "BGE-small-en-v1.5 is a compact English sentence embedding model that converts text into meaningful numerical representations for semantic similarity tasks. It employs contrastive learning with hard negatives and knowledge distillation from larger models, achieving strong performance despite its small size. You can use it for semantic search, clustering similar documents, or as a lightweight encoder in retrieval-augmented generation pipelines, making it ideal for resource-constrained applications."
      },
      "summary_short": {
        "zh": "BGE-small-en-v1.5 是一个高效的英文句子嵌入模型，能够将文本转换为语义丰富的向量表示，专门解决文档相似度计算和语义搜索问题。它通过对比学习结合困难负样本挖掘，并采用知识蒸馏技术从大模型中学习，在保持轻量级的同时实现了优异的性能表现。开发者可将其用于构建智能检索系统、文档聚类分析，或作为RAG架构中的编码器，特别适合部署在计算资源有限的环境中探索语义理解应用。",
        "en": "BGE-small-en-v1.5 is a compact English sentence embedding model that converts text into meaningful numerical representations for semantic similarity tasks. It employs contrastive learning with hard negatives and knowledge distillation from larger models, achieving strong perform…",
        "es": "BGE-small-en-v1.5 is a compact English sentence embedding model that converts text into meaningful numerical representations for semantic similarity tasks. It employs contrastive learning with hard negatives and knowledge distillation from larger models, achieving strong perform…"
      },
      "locales": [
        "en",
        "zh",
        "es"
      ],
      "provider": {
        "name": "deepseek-tri",
        "version": "1.0.0",
        "mode": "json_single"
      },
      "quality": {
        "score": 0.92,
        "fallback": false,
        "length": {
          "en": 501,
          "zh": 188,
          "es": 501
        },
        "warnings": [
          "es_short:0"
        ],
        "accepted_at": "2025-10-11T07:00:49.059Z"
      },
      "stats": {
        "downloads_total": 39663955,
        "likes_total": 490
      },
      "metadata": {
        "license": "N/A",
        "lang": "N/A",
        "categories": {
          "capabilities": [],
          "scenes": [],
          "lifecycle": []
        }
      },
      "created_at": "2025-10-11T07:00:49.059Z",
      "updated_at": "2025-10-11T07:00:49.059Z",
      "first_generated_at": "2025-10-11T07:00:49.059Z",
      "source": "huggingface"
    },
    {
      "canonical_id": "huggingface:Qwen/Qwen3-VL-32B-Instruct",
      "promptHash": "sha256:08e75d98accfa5656d823fd4c9ecd237d3778e69e6a40f4403a27b859b5cfb90",
      "summary_version": 1,
      "status": "qualified",
      "name": "Qwen3-VL-32B-Instruct",
      "url": "https://huggingface.co/Qwen/Qwen3-VL-32B-Instruct",
      "tags": [
        "transformers",
        "safetensors",
        "qwen3_vl",
        "image-text-to-text",
        "conversational",
        "arxiv:2505.09388",
        "arxiv:2502.13923",
        "arxiv:2409.12191",
        "arxiv:2308.12966",
        "license:apache-2.0",
        "endpoints_compatible",
        "deploy:azure",
        "region:us"
      ],
      "summaries": {
        "en": "Qwen3-VL-32B-Instruct is a multimodal AI model that understands both images and text, enabling visual question answering and document analysis. Its key innovation is a dynamic resolution mechanism that adapts input image sizes to preserve fine details, improving OCR and object recognition. You can deploy it via Hugging Face Transformers for tasks like image captioning, visual QA, or building conversational agents that see. The Apache 2.0 license allows flexible use in research and commercial applications.",
        "zh": "Qwen3-VL-32B-Instruct 是一个同时理解图像和文本的多模态AI模型，专为视觉问答、文档分析等任务设计。其核心技术亮点是动态分辨率机制：模型会根据输入图像自动调整处理粒度，保留微小文字和物体细节，显著提升OCR和细粒度识别能力。你可以通过Hugging Face Transformers库快速部署，用于图像描述、基于图片的对话系统或自动化文档信息提取。该模型采用Apache 2.0许可证，支持研究及商业用途。试试用它分析一张复杂图表或手写笔记，感受多模态推理的潜力。",
        "es": "Qwen3-VL-32B-Instruct is a multimodal AI model that understands both images and text, enabling visual question answering and document analysis. Its key innovation is a dynamic resolution mechanism that adapts input image sizes to preserve fine details, improving OCR and object recognition. You can deploy it via Hugging Face Transformers for tasks like image captioning, visual QA, or building conversational agents that see. The Apache 2.0 license allows flexible use in research and commercial applications."
      },
      "summary_short": {
        "zh": "Qwen3-VL-32B-Instruct 是一个同时理解图像和文本的多模态AI模型，专为视觉问答、文档分析等任务设计。其核心技术亮点是动态分辨率机制：模型会根据输入图像自动调整处理粒度，保留微小文字和物体细节，显著提升OCR和细粒度识别能力。你可以通过Hugging Face Transformers库快速部署，用于图像描述、基于图片的对话系统或自动化文档信息提取。该模型采用Apache 2.0许可证，支持研究及商业用途。试试用它分析一张复杂图表或手写笔记，感受多模态推理的潜力。",
        "en": "Qwen3-VL-32B-Instruct is a multimodal AI model that understands both images and text, enabling visual question answering and document analysis. Its key innovation is a dynamic resolution mechanism that adapts input image sizes to preserve fine details, improving OCR and object r…",
        "es": "Qwen3-VL-32B-Instruct is a multimodal AI model that understands both images and text, enabling visual question answering and document analysis. Its key innovation is a dynamic resolution mechanism that adapts input image sizes to preserve fine details, improving OCR and object r…"
      },
      "locales": [
        "en",
        "zh",
        "es"
      ],
      "provider": {
        "name": "deepseek-tri",
        "version": "1.0.0",
        "mode": "json_single"
      },
      "quality": {
        "score": 0.92,
        "fallback": false,
        "length": {
          "en": 510,
          "zh": 243,
          "es": 510
        },
        "warnings": [
          "es_short:0"
        ],
        "accepted_at": "2026-06-16T03:57:49.308Z"
      },
      "stats": {
        "downloads_total": 2236870,
        "likes_total": 204
      },
      "metadata": {
        "license": "N/A",
        "lang": "N/A",
        "categories": {
          "capabilities": [],
          "scenes": [],
          "lifecycle": []
        }
      },
      "created_at": "2026-06-16T03:57:49.308Z",
      "updated_at": "2026-06-16T03:57:49.308Z",
      "first_generated_at": "2026-06-16T03:57:49.308Z",
      "source": "huggingface"
    }
  ],
  "stats": {
    "total": 2,
    "matched_prompt_hash": 2,
    "mismatched_prompt_hash": 4
  }
}
