{
  "schema_version": 1,
  "pipeline_version": "v6",
  "run_id": "data-analysis-2025-12-19-20251219030907.-501acefd",
  "date": "2025-12-19",
  "source": "huggingface",
  "generated_at": "2025-12-19T03:09:07.633Z",
  "items": [
    {
      "canonical_id": "huggingface:Alibaba-NLP/gte-multilingual-base",
      "promptHash": "sha256:b3ec2b0eebb2de74d3747fcae17104433679a2f36ffbb3e743d13ac640bd6a3d",
      "summary_version": 1,
      "status": "qualified",
      "name": "gte-multilingual-base",
      "url": "https://huggingface.co/Alibaba-NLP/gte-multilingual-base",
      "tags": [
        "sentence-transformers",
        "safetensors",
        "new",
        "feature-extraction",
        "mteb",
        "transformers",
        "multilingual",
        "sentence-similarity",
        "text-embeddings-inference",
        "custom_code",
        "af",
        "ar",
        "az",
        "be",
        "bg",
        "bn",
        "ca",
        "ceb",
        "cs",
        "cy",
        "da",
        "de",
        "el",
        "en",
        "es",
        "et",
        "eu",
        "fa",
        "fi",
        "fr",
        "gl",
        "gu",
        "he",
        "hi",
        "hr",
        "ht",
        "hu",
        "hy",
        "id",
        "is",
        "it",
        "ja",
        "jv",
        "ka",
        "kk",
        "km",
        "kn",
        "ko",
        "ky",
        "lo",
        "lt",
        "lv",
        "mk",
        "ml",
        "mn",
        "mr",
        "ms",
        "my",
        "ne",
        "nl",
        "no",
        "pa",
        "pl",
        "pt",
        "qu",
        "ro",
        "ru",
        "si",
        "sk",
        "sl",
        "so",
        "sq",
        "sr",
        "sv",
        "sw",
        "ta",
        "te",
        "th",
        "tl",
        "tr",
        "uk",
        "ur",
        "vi",
        "yo",
        "zh",
        "arxiv:2407.19669",
        "arxiv:2210.09984",
        "arxiv:2402.03216",
        "arxiv:2007.15207",
        "arxiv:2104.08663",
        "arxiv:2402.07440",
        "license:apache-2.0",
        "model-index",
        "endpoints_compatible",
        "deploy:azure",
        "region:us"
      ],
      "summaries": {
        "en": "GTE-Multilingual-Base is a multilingual sentence embedding model that enables semantic similarity comparisons across 100+ languages, solving the challenge of cross-lingual information retrieval and content matching. It uses a shared transformer architecture with language-agnostic training to create comparable embeddings regardless of input language. Researchers can use it via Hugging Face's sentence-transformers library to build multilingual search systems, cluster documents across languages, or enhance cross-lingual recommendation engines with just a few lines of code.",
        "zh": "GTE-Multilingual-Base 是一个多语言句子嵌入模型，能够在100多种语言间进行语义相似度计算，解决了跨语言信息检索和内容匹配的难题。它采用共享的Transformer架构，通过语言无关的训练方法，使不同语言的文本生成可比较的向量表示。开发者可以通过Hugging Face的sentence-transformers库快速集成，用于构建多语言搜索引擎、跨语言文档聚类系统，或为推荐引擎添加多语言理解能力，只需几行代码即可实现跨语言语义匹配功能。",
        "es": "GTE-Multilingual-Base is a multilingual sentence embedding model that enables semantic similarity comparisons across 100+ languages, solving the challenge of cross-lingual information retrieval and content matching. It uses a shared transformer architecture with language-agnostic training to create comparable embeddings regardless of input language. Researchers can use it via Hugging Face's sentence-transformers library to build multilingual search systems, cluster documents across languages, or enhance cross-lingual recommendation engines with just a few lines of code."
      },
      "summary_short": {
        "zh": "GTE-Multilingual-Base 是一个多语言句子嵌入模型，能够在100多种语言间进行语义相似度计算，解决了跨语言信息检索和内容匹配的难题。它采用共享的Transformer架构，通过语言无关的训练方法，使不同语言的文本生成可比较的向量表示。开发者可以通过Hugging Face的sentence-transformers库快速集成，用于构建多语言搜索引擎、跨语言文档聚类系统，或为推荐引擎添加多语言理解能力，只需几行代码即可实现跨语言语义匹配功能。",
        "en": "GTE-Multilingual-Base is a multilingual sentence embedding model that enables semantic similarity comparisons across 100+ languages, solving the challenge of cross-lingual information retrieval and content matching. It uses a shared transformer architecture with language-agnosti…",
        "es": "GTE-Multilingual-Base is a multilingual sentence embedding model that enables semantic similarity comparisons across 100+ languages, solving the challenge of cross-lingual information retrieval and content matching. It uses a shared transformer architecture with language-agnosti…"
      },
      "locales": [
        "en",
        "zh",
        "es"
      ],
      "provider": {
        "name": "deepseek-tri",
        "version": "1.0.0",
        "mode": "json_single"
      },
      "quality": {
        "score": 0.92,
        "fallback": false,
        "length": {
          "en": 576,
          "zh": 231,
          "es": 576
        },
        "warnings": [
          "es_short:0"
        ],
        "accepted_at": "2025-12-19T03:06:50.591Z"
      },
      "stats": {
        "downloads_total": 2005941,
        "likes_total": 339
      },
      "metadata": {
        "license": "N/A",
        "lang": "N/A",
        "categories": {
          "capabilities": [],
          "scenes": [],
          "lifecycle": []
        }
      },
      "created_at": "2025-12-19T03:06:50.591Z",
      "updated_at": "2025-12-19T03:06:50.591Z",
      "first_generated_at": "2025-12-19T03:06:50.591Z",
      "source": "huggingface"
    },
    {
      "canonical_id": "huggingface:timm/mobilenetv3_large_100.ra_in1k",
      "promptHash": "sha256:07541291cb88ed8b08ed29f93a6081b5109e8ed348ee3646c4d89b9a218706b5",
      "summary_version": 1,
      "status": "qualified",
      "name": "mobilenetv3_large_100.ra_in1k",
      "url": "https://huggingface.co/timm/mobilenetv3_large_100.ra_in1k",
      "tags": [
        "timm",
        "pytorch",
        "safetensors",
        "image-classification",
        "transformers",
        "dataset:imagenet-1k",
        "arxiv:2110.00476",
        "arxiv:1905.02244",
        "license:apache-2.0",
        "region:us"
      ],
      "summaries": {
        "en": "MobileNetV3-Large-100 is an efficient convolutional neural network optimized for mobile and edge devices, solving the challenge of running accurate image classification on resource-limited hardware. Its technical innovation lies in combining depthwise separable convolutions with squeeze-and-excitation modules and a novel hard-swish activation function, achieving strong accuracy with minimal computational cost. You can fine-tune it for custom image recognition tasks using PyTorch or deploy it directly via Hugging Face's transformers library for applications like mobile photography or embedded vision systems.",
        "zh": "MobileNetV3-Large-100是一款专为移动和边缘设备设计的高效卷积神经网络，解决了在计算资源受限的硬件上实现准确图像分类的难题。其技术核心在于巧妙结合深度可分离卷积与挤压激励模块，并引入创新的硬切换激活函数，在保持较低计算开销的同时获得出色的分类精度。开发者可通过PyTorch框架对其进行微调以适应特定视觉任务，或直接通过Hugging Face的transformers库部署到移动应用中，为智能手机摄影、嵌入式视觉系统等场景提供轻量级AI解决方案。",
        "es": "MobileNetV3-Large-100 is an efficient convolutional neural network optimized for mobile and edge devices, solving the challenge of running accurate image classification on resource-limited hardware. Its technical innovation lies in combining depthwise separable convolutions with squeeze-and-excitation modules and a novel hard-swish activation function, achieving strong accuracy with minimal computational cost. You can fine-tune it for custom image recognition tasks using PyTorch or deploy it directly via Hugging Face's transformers library for applications like mobile photography or embedded vision systems."
      },
      "summary_short": {
        "zh": "MobileNetV3-Large-100是一款专为移动和边缘设备设计的高效卷积神经网络，解决了在计算资源受限的硬件上实现准确图像分类的难题。其技术核心在于巧妙结合深度可分离卷积与挤压激励模块，并引入创新的硬切换激活函数，在保持较低计算开销的同时获得出色的分类精度。开发者可通过PyTorch框架对其进行微调以适应特定视觉任务，或直接通过Hugging Face的transformers库部署到移动应用中，为智能手机摄影、嵌入式视觉系统等场景提供轻量级AI解决方案。",
        "en": "MobileNetV3-Large-100 is an efficient convolutional neural network optimized for mobile and edge devices, solving the challenge of running accurate image classification on resource-limited hardware. Its technical innovation lies in combining depthwise separable convolutions with…",
        "es": "MobileNetV3-Large-100 is an efficient convolutional neural network optimized for mobile and edge devices, solving the challenge of running accurate image classification on resource-limited hardware. Its technical innovation lies in combining depthwise separable convolutions with…"
      },
      "locales": [
        "en",
        "zh",
        "es"
      ],
      "provider": {
        "name": "deepseek-tri",
        "version": "1.0.0",
        "mode": "json_single"
      },
      "quality": {
        "score": 0.92,
        "fallback": false,
        "length": {
          "en": 614,
          "zh": 234,
          "es": 614
        },
        "warnings": [
          "es_short:0"
        ],
        "accepted_at": "2025-12-19T03:06:50.591Z"
      },
      "stats": {
        "downloads_total": 1990533,
        "likes_total": 34
      },
      "metadata": {
        "license": "N/A",
        "lang": "N/A",
        "categories": {
          "capabilities": [],
          "scenes": [],
          "lifecycle": []
        }
      },
      "created_at": "2025-12-19T03:06:50.591Z",
      "updated_at": "2025-12-19T03:06:50.591Z",
      "first_generated_at": "2025-12-19T03:06:50.591Z",
      "source": "huggingface"
    }
  ],
  "stats": {
    "total": 2,
    "matched_prompt_hash": 2,
    "mismatched_prompt_hash": 5
  }
}
